"CO_PPE";"NO_PPE";"NO_PPE_MIN";"NO_PPE_ING"
"1011";"ABACAXIS FRESCOS OU SECOS";"Abacaxis frescos ou secos";"PINEAPPLES, FRESH OR DRIED"
"1041";"ARROZ EM GRAOS, INCLUSIVE ARROZ QUEBRADO";"Arroz em grãos, inclusive arroz quebrado";"RICE IN GRAIN, INCLUDING BROKEN RICE"
"1051";"ALGODAO EM BRUTO";"Algodão em bruto";"RAW COTTON"
"1052";"AMENDOIM EM GRAO";"Amendoim em grão";"PEANUTS, IN GRAIN"
"1055";"AMIANTO";"Amianto";"ASBESTOS"
"1061";"BANANAS FRESCAS OU SECAS";"Bananas frescas ou secas";"BANANAS, FRESH OR DRIED"
"1063";"BULBOS, TUBERCULOS, ETC.EM REPOUSO VEGETAT.FLOR OU MUDA";"Bulbos, tubérculos, etc.em repouso vegetat.flor ou muda";"BULBS, TUBERS, ETC. DORMANT CHANGES IN FLOWER"
"1067";"CRAVO-DA-INDIA";"Cravo-da-Índia";"CLOVES"
"1075";"CACAU INTEIRO OU PARTIDO, EM BRUTO OU TORRADO";"Cacau inteiro ou partido, em bruto ou torrado";"COCOA BEANS, WHOLE OR BROKEN, RAW OR ROASTED"
"1080";"CAFE CRU EM GRAO";"Café cru em grão";"COFFEE  NOT ROASTED, IN GRAIN"
"1082";"CAFE TORRADO, DESCAFEINADO OU NAO";"Café torrado, descafeinado ou não";"COFFEE ROASTED, DECAFFEINATED"
"1083";"ALUMINIO EM DESPERDICIOS E RESIDUOS";"Alumínio em desperdícios e resíduos";"ALUMINIUM AND WASTE"
"1084";"BOVINOS VIVOS";"Bovinos vivos";"LIVE CATTLE"
"1085";"CINZAS E RESIDUOS CONTENDO METAIS";"Cinzas e resíduos contendo metais";"ASHES AND RESIDUES CONTAINING METALS"
"1087";"CROMITA (MINERIO DE CROMO)";"Cromita (minério de cromo)";"CHROMITE (CHROMIUM ORE)"
"1095";"CAMARAO CONGELADO";"Camarão congelado";"FROZEN SHRIMP"
"1100";"CARNE DE BOVINO CONGELADA, FRESCA OU REFRIGERADA";"Carne de bovino congelada, fresca ou refrigerada";"BEEF FROZEN, FRESH OR CHILLED"
"1110";"CARNE DE EQUINO CONGELADA, FRESCA OU REFRIGERADA";"Carne de equino congelada, fresca ou refrigerada";"EQUINE FROZEN MEAT, FRESH OR CHILLED"
"1116";"CARNE DE FRANGO CONGELADA, FRESCA OU REFRIG.INCL.MIUDOS";"Carne de frango congelada, fresca ou refrig.incl.miudos";"FROZEN CHICKEN MEAT, FRESH OR CHILLED"
"1117";"CARNE DE SUINO CONGELADA, FRESCA OU REFRIGERADA";"Carne de suíno congelada, fresca ou refrigerada";"PIGMEAT FROZEN, FRESH OR CHILLED"
"1118";"CARNES SALGADAS, INCLUIDAS AS DE FRANGO";"Carnes salgadas, incluídas as de frango";"CORNED BEEF, INCLUDED THE CHICKEN"
"1119";"CARNE DE PATO/GANSO, CONG.,FRESCA OU REFRIG.INCL.MIUDOS";"Carne de pato/ganso, cong.,fresca ou refrig.incl.miúdos";"DUCK MEAT / GEESE, FROZEN, FRESH OR CHILLED"
"1120";"CASTANHA DO PARA (CASTANHA DO BRASIL)";"Castanha do para (castanha do brasil)";"BRAZIL NUTS"
"1130";"CASTANHA DE CAJU";"Castanha de caju";"CASHEW NUTS"
"1135";"CAULIM E OUTRAS ARGILAS CAULINICAS";"Caulim e outras argilas caulinicas";"KAOLIN AND OTHER CLAYS"
"1137";"CINZAS, DESPERDICIOS E RESIDUOS, DE METAIS PRECIOSOS";"Cinzas, desperdícios e resíduos, de metais preciosos";"ASH, RESIDUES AND WASTE OF PRECIOUS METALS"
"1138";"DESPERDICIOS E RESIDUOS DE COBRE";"Desperdícios e resíduos de cobre";"COPPER WASTE AND WASTE"
"1139";"DESPERDICIOS E RESIDUOS DE FERRO OU ACO";"Desperdícios e resíduos de ferro ou aço";"WASTE AND SCRAP OF IRON OR STEEL"
"1150";"MATE";"Mate";"MATE"
"1175";"MATERIAS,DESPERDICIOS E RESIDUOS VEGETAIS P/ALIM.ANIMAL";"Matérias,desperdícios e resíduos vegetais p/alim.animal";"MATERIALS, WASTE AND WASTE PLANT FEED"
"1180";"FARELO E RESIDUOS DA EXTRACAO DE OLEO DE SOJA";"Farelo e resíduos da extração de óleo de soja";"MEAL AND RESIDUES FROM SOYBEAN OIL"
"1185";"GAS NATURAL";"Gás natural";"NATURAL GAS"
"1190";"GOIABAS, MANGAS E MANGOSTOES FRESCOS";"Goiabas, mangas e mangostões frescos";"GUAVAS, MANGOES AND MANGOSTEENS, FRESH"
"1200";"GOMA-LACA, GOMAS E RESINAS NATURAIS";"Goma-laca, gomas e resinas naturais";"SHELLAC, NATURAL GUMS AND RESINS"
"1201";"FUMO EM FOLHAS E DESPERDICIOS";"Fumo em folhas e desperdícios";"SMOKING IN LEAVES AND WASTE"
"1210";"MARMORES E GRANITOS, EM BRUTO OU DESBASTADOS";"Mármores e granitos, em bruto ou desbastados";"MARBLE AND GRANITE, CRUDE OR ROUGHLY TRIMMED"
"1215";"GRAFITA NATURAL";"Grafita natural";"NATURAL GRAPHITE"
"1222";"LAGOSTAS CONGELADAS";"Lagostas congeladas";"CRAWFISH FROZEN"
"1223";"LARANJAS FRESCAS OU SECAS";"Laranjas frescas ou secas";"ORANGES, FRESH OR DRIED"
"1224";"LIMOES E LIMAS, FRESCOS OU SECOS";"Limões e limas, frescos ou secos";"LEMONS AND LIMES, FRESH OR DRIED"
"1226";"MAGNESIA CALCINADA A FUNDO E OUTROS OXIDOS DE MAGNESIO";"Magnésia calcinada a fundo e outros óxidos de magnésio";"MAGNESIA-BURNED AND OTHER MAGNESIUM OXIDE"
"1235";"MELOES FRESCOS";"Melões frescos";"MELONS,  FRESH"
"1240";"MILHO EM GRAOS";"Milho em grãos";"MAIZE "
"1253";"MADEIRAS EM BRUTO";"Madeiras em bruto";"WOOD "
"1255";"MINERIOS DE ALUMINIO E SEUS CONCENTRADOS";"Minérios de alumínio e seus concentrados";"ALUMINUM ORE AND CONCENTRATES"
"1257";"MINERIOS DE CHUMBO E SEUS CONCENTRADOS";"Minérios de chumbo e seus concentrados";"LEAD ORES AND CONCENTRATES"
"1258";"MINERIOS DE FERRO E SEUS CONCENTRADOS";"Minérios de ferro e seus concentrados";"IRON ORE AND CONCENTRATES ITS"
"1260";"MINERIOS DE MANGANES E SEUS CONCENTRADOS";"Minérios de manganês e seus concentrados";"MANGANESE ORE CONCENTRATES AND THEIR"
"1263";"MUDAS, ENXERTOS E PLANTAS VIVAS";"Mudas, enxertos e plantas vivas";"PLANTS, LIVE PLANTS AND SLIPS"
"1265";"CARNE DE PERU CONGELADA, FRESCA OU REFRIG. INCL. MIUDOS";"Carne de peru congelada, fresca ou refrig. incl. miúdos";"FROZEN TURKEY MEAT, FRESH OR CHILLED, INCLUDING PIECES"
"1267";"ORGAOS E SUBSTANCIAS DE ANIMAIS, P/PREPAR.PRODS.FARMAC.";"Órgãos e substâncias de animais, p/prepar.prods.farmac.";"ORGANS AND SUBST OF ANIMALS, AND PREPAR. FOR PHARMACEUT"
"1269";"OVOS DE GALINHAS";"Ovos de galinhas";"CHICKEN EGGS"
"1275";"PEDRAS PRECIOSAS OU SEMIPRECIOSAS,EM BRUTO,NAO ENGASTAD";"Pedras preciosas ou semipreciosas,em bruto,não engastad";"PRECIOUS STONES, RAW, NOT SET"
"1290";"PIMENTA EM GRAO";"Pimenta em grão";"PEPPER IN GRAIN"
"1296";"FARELO E RESIDUOS DA EXTRACAO DE OLEOS VEGET.,EXC. SOJA";"Farelo e resíduos da extração de óleos veget.,exc. soja";"MEAL AND RESIDUES FROM VEGETABLE OILS, EXC.SOJA"
"1301";"SISAL E OUTRAS FIBRAS TEXTEIS ""AGAVE"" EM BRUTO";"Sisal e outras fibras têxteis ""agave"" em bruto";"SISAL AND OTHER TEXTILE AGAVE RAW"
"1315";"SOJA MESMO TRITURADA";"Soja mesmo triturada";"SOYBEANS, WHETHER OR NOT BROKEN"
"1321";"TRIPAS E BUCHOS DE ANIMAIS, FRESCOS, SALGADOS OU SECOS";"Tripas e buchos de animais, frescos, salgados ou secos";"GUTS AND STOMACHS OF ANIMALS, FRESH, SALTED OR DRIED"
"1325";"UVAS FRESCAS";"Uvas frescas";"GRAPES,FRESH"
"1327";"MACAS FRESCAS";"Maçãs frescas";"APPLES, FRESH"
"1329";"MAMOES (PAPAIAS) FRESCOS";"Mamões (papaias) frescos";"PAPAWS (PAPAYAS), FRESH"
"1365";"MEL NATURAL";"Mel natural";"NATURAL HONEY"
"1380";"PEIXES CONGELADOS, FRESCOS OU REFRIGERADOS";"Peixes congelados, frescos ou refrigerados";"FROZEN FISH, FRESH OR CHILLED"
"1400";"SEMENTES FORRAGEIRAS EXCETO DE BETERRABA";"Sementes forrageiras exceto de beterraba";"FORAGE SEEDS, EXCEPT BEET"
"1507";"MINERIOS DE COBRE E SEUS CONCENTRADOS";"Minérios de cobre e seus concentrados";"COPPER ORES AND THEIR CONCENTRATES"
"1511";"MIUDEZAS DE ANIMAIS, COMESTIVEIS";"Miudezas de animais, comestíveis";"ANIMAL OFFAL, EDIBLE"
"1631";"OLEOS BRUTOS DE PETROLEO";"Óleos brutos de petróleo";"CRUDE OIL"
"1801";"TRIGO EM GRAOS";"Trigo em grãos";"WHEAT IN GRAIN"
"1990";"DEMAIS PRODUTOS BASICOS";"Demais produtos básicos";"OTHER BASIC GOODS"
"2010";"ACUCAR DE CANA, EM BRUTO";"Açúcar de cana, em bruto";"CANE SUGAR, RAW"
"2015";"ALUMINIO EM BRUTO";"Alumínio em bruto";"RAW ALUMINUM"
"2016";"BORRACHA SINTETICA E BORRACHA ARTIFICIAL";"Borracha sintética e borracha artificial";"RUBBER AND RUBBER SYNTHETIC ARTIFICIAL"
"2017";"CATODOS DE COBRE";"Catodos de cobre";"COPPER CATHODE"
"2018";"CATODOS DE NIQUEL";"Catodos de níquel";"NICKEL CATHODE"
"2020";"CERAS VEGETAIS";"Ceras vegetais";"VEGETABLE WAXES"
"2022";"COBALTO EM BRUTO";"Cobalto em bruto";"COBALT IN GROSS"
"2028";"COUROS E PELES, DEPILADOS, EXCETO EM BRUTO";"Couros e peles, depilados, exceto em bruto";"HIDES AND SKINS, DEHAIRED EXCEPT CRUDE"
"2029";"PELETERIA, EXCETO EM BRUTO";"Peleteria, exceto em bruto";"PELET, EXCEPT CRUDE"
"2030";"ESTANHO EM BRUTO";"Estanho em bruto";"TIN, CRUDE"
"2036";"EXTRATOS TANANTES DE ORIGEM VEGETAL";"Extratos tanantes de origem vegetal";"TANNING EXTRACTS OF VEGETABLE"
"2040";"CACAU EM PO";"Cacau em pó";"COCOA POWDER"
"2050";"FERRO FUNDIDO BRUTO E FERRO SPIEGEL (EX FERRO GUSA)";"Ferro fundido bruto e ferro spiegel (ex ferro gusa)";"CAST IRON AND CRUDE IRON SPIEGEL (EX PIG IRON)"
"2061";"FERRO-LIGAS";"Ferro-ligas";"FERRO-ALLOYS"
"2075";"LIGAS DE ALUMINIO, EM BRUTO";"Ligas de alumínio, em bruto";"ALUMINUM ALLOY, RAW"
"2130";"MADEIRA LAMINADA";"Madeira laminada";"LAMINATED WOOD"
"2136";"MADEIRA SERRADA OU FENDIDA LONGITUD. DE ESPESSURA > 6MM";"Madeira serrada ou fendida longitud. de espessura > 6mm";"WOOD SAWN OR CHIPPE LONGITUD. OF THICKNESS > 6MM"
"2140";"MANTEIGA, GORDURA E OLEO, DE CACAU";"Manteiga, gordura e óleo, de cacau";"COCOA BUTTER, FAT AND OIL"
"2145";"MADEIRA EM ESTILHAS OU EM PARTICULAS";"Madeira em estilhas ou em partículas";"WOOD IN CHIPS OR PARTICLES"
"2151";"MATES DE COBRE, COBRE DE CEMENTACAO (PRECIPIT.DE COBRE)";"Mates de cobre, cobre de cementação (precipit.de cobre)";"COPPER MATTES, CEMENT COPPER (PRECIPIT.DE COPPER)"
"2153";"MATES DE NIQUEL E PRODS. INTERMED. METALURGIA DO NIQUEL";"Mates de níquel e prods. intermed. metalurgia do níquel";"MATES OF NICKEL AND NICKEL PRODS.INTERMED.METALURGY"
"2165";"OLEO DE DENDE EM BRUTO";"Óleo de dendê em bruto";"CRUDE PALM OIL"
"2167";"OLEO DE MILHO, EM BRUTO";"Óleo de milho, em bruto";"CORN OIL, CRUDE"
"2180";"OLEO DE SOJA EM BRUTO";"Óleo de soja em bruto";"SOYBEAN OIL CRUDE"
"2185";"OURO EM FORMAS SEMIMANUFATURADAS,PARA USO NAO MONETARIO";"Ouro em formas semimanufaturadas,para uso não monetário";"GOLD IN FORMS TURES FOR NON-MONETARY"
"2190";"PASTA DE CACAU";"Pasta de cacau";"COCOA PASTE"
"2203";"CELULOSE";"Celulose";"WOOD PULP"
"2204";"PEDRAS P/CALCETAR, PLACAS P/PAVIMENT. DE PEDRA NATURAL";"Pedras p/calcetar, placas p/paviment. de pedra natural";"SETTS, PLATES FOR PAVING STONE"
"2205";"PIMENTOES E PIMENTAS TRITURADAS OU EM PO";"Pimentões e pimentas trituradas ou em pó";"CHILLI PEPPERS AND CRUSHED OR POWDERED"
"2207";"PRODUTOS SEMIMANUFATURADOS DE FERRO OU ACOS";"Produtos semimanufaturados de ferro ou aços";"SEMI-FINISHED PRODUCTS IRON OR STEEL"
"2210";"OLEO DE RICINO";"Óleo de rícino";"CASTOR OIL"
"2230";"TOPS DE LA PENTEADA";"Tops de lã penteada";"TOPS WORSTED"
"2235";"ZINCO EM BRUTO";"Zinco em bruto";"ZINC, RAW"
"2260";"SUCOS E EXTRATOS VEGETAIS E MATERIAS PECTICAS";"Sucos e extratos vegetais e matérias pécticas";"SAPS AND EXTRACTS AND PECTIC"
"2455";"PRATA EM BARRAS,FIOS,PERFIS DE SEC.MACICA,FORMA SEMIMAN";"Prata em barras,fios,perfis de sec.maciça,forma semiman";"SILVER IN BARS, WIRE, PROFILES SEC.MACICA, SEMI-FORM"
"2990";"DEMAIS PRODUTOS SEMIMANUFATURADOS";"Demais produtos semimanufaturados";"OTHER SEMIMANUFACTURED GOODS"
"3000";"ACIDOS CARBOXILICOS, SEUS ANIDRIDOS, HALOGENETOS, ETC.";"Ácidos carboxílicos, seus anidridos, halogenetos, etc.";"CARBOXYLIC ACIDS, THEIR ANHYDRIDES, HALIDES, ETC."
"3005";"ACELERADORES DE REACAO E PREPARACOES CATALITICAS";"Aceleradores de reação e preparações catalíticas";"REACTION ACCELERATORS AND CATALYTIC PREPARATIONS"
"3010";"ACUCAR REFINADO";"Açúcar refinado";"CANE SUGAR, REFINED"
"3013";"ADITIVOS PARA OLEOS LUBRIFICANTES";"Aditivos para óleos lubrificantes";"ADDITIVES FOR LUBRICATING OILS"
"3015";"ADUBOS OU FERTILIZ.CONT. NITROGENIO, FOSFORO E POTASSIO";"Adubos ou fertiliz.cont. nitrogênio, fosforo e potássio";"FERTILIZERS CONTAINING NITROGEN, PHOSPHORUS AND POTASSI"
"3016";"ADUBOS OU FERTILIZANTES FOSFATADOS";"Adubos ou fertilizantes fosfatados";"PHOSPHATE FERTILIZERS"
"3017";"ALCOOIS ACICLICOS E SEUS DERIVADOS HALOGENADOS, ETC.";"Álcoóis acíclicos e seus derivados halogenados, etc.";"ACYCLIC ALCOHOLS AND THEIR HALOGENATED, ETC."
"3022";"AMPOLAS DE VIDRO PARA TUBOS CATODICOS";"Ampolas de vidro para tubos catódicos";"AMPOULES OF GLASS FOR CATHODE RAY TUBES"
"3024";"ARTIGOS E APARS. DE PROTESE, DE ORTOPEDIA E SUAS PARTES";"Artigos e apars. de prótese, de ortopedia e suas partes";"ARTICLES AND APPARATUS PROSTHESIS, AND PARTS OF ORTHOPE"
"3026";"ETANOL";"Etanol";"ETHANOL"
"3028";"ANTIBIOTICOS";"Antibióticos";"ANTIBIOTICS"
"3029";"APARELHOS ELETR.DE SINALIZ.CONTROLE,ETC. P/VIAS FERREAS";"Aparelhos eletr.de sinaliz.controle,etc. p/vias férreas";"ELECTRIC SIGNAL AND CONTROL, ETC. TRAMWAY"
"3033";"ARDOSIA NATURAL E OBRAS DE ARDOSIA";"Ardósia natural e obras de ardósia";"SLATE AND ARTICLES OF SLATE"
"3034";"ALUMINIO, EM BARRAS, PERFIS, FIOS,CHAPAS,FOLHAS E TIRAS";"Alumínio, em barras, perfis, fios,chapas,folhas e tiras";"ALUMINUM IN BARS, PROFILES, WIRES, PLATES, SHEETS AND S"
"3036";"ARTIGOS DE JOALHERIA DE METAIS PRECIOSOS E SUAS PARTES";"Artigos de joalheria de metais preciosos e suas partes";"ARTICLES OF PRECIOUS METAL JEWELRY AND PARTS"
"3038";"AQUECEDOR, SECADOR OU TROCADOR DE CALOR, PARTES E PECAS";"Aquecedor, secador ou trocador de calor, partes e pecas";"HEATER, DRYER OR HEAT EXCHANGER, AND SPARE PARTS"
"3040";"PNEUMATICOS";"Pneumáticos";"PNEUMATIC"
"3046";"COBRE, EM BARRAS, PERFIS, FIOS, CHAPAS, FOLHAS E TIRAS";"Cobre, em barras, perfis, fios, chapas, folhas e tiras";"COPPER IN BARS, PROFILES, WIRES, PLATES, SHEETS AND STR"
"3049";"CORINDO ARTIFICIAL";"Corindo artificial";"ARTIFICIAL CORUNDUM"
"3051";"ENCHIDOS DE CARNE";"Enchidos de carne";"CURED MEAT"
"3052";"ESPELHOS RETROVISORES PARA VEICULOS";"Espelhos retrovisores para veículos";"REAR-VIEW MIRROR FOR VEHICLES"
"3053";"FOSFORO (ELEMENTO QUIMICO NAO METALICO)";"Fosforo (elemento químico não metálico)";"PHOSPHORUS (CHEMICAL ELEMENT NON-METALLIC)"
"3058";"BARRAS, PERFIS E FIOS DE NIQUEL";"Barras, perfis e fios de níquel";"BARS, PROFILES AND WIRE OF NICKEL"
"3060";"BOMBAS, COMPRESSORES, VENTILADORES, ETC. E SUAS PARTES";"Bombas, compressores, ventiladores, etc. e suas partes";"PUMPS, COMPRESSORS, FANS, ETC. AND PARTS"
"3065";"BORRACHA MISTURADA,N/VULCAN.EM FORMA PRIMAR,CHAPAS,FLS.";"Borracha misturada,n/vulcan.em forma primar,chapas,fls.";"RUBBER, UNVULCANIZED, IN PRIMARY FORMS, PLATES, SHEETS"
"3070";"BRINQUEDOS, JOGOS E ARTIGOS PARA DIVERSAO E SUAS PARTES";"Brinquedos, jogos e artigos para diversão e suas partes";"TOYS, GAMES AND FUN ITEMS AND PARTS"
"3071";"ARTEFATOS P/USO DOMESTICO,DE FERRO FUNDIDO,FERRO OU ACO";"Artefatos p/uso doméstico,de ferro fundido,ferro ou aço";"WORN FOR DOMESTIC, OF IRON OR STEEL"
"3073";"ARMACOES E CABOS DE FERRAMENTAS OU VASSOURAS,DE MADEIRA";"Armações e cabos de ferramentas ou vassouras,de madeira";"FRAMES AND TOOLS OR BROOMS HANDLES, OF WOOD"
"3075";"CABOS E FIBRAS SINTETICAS OU ARTIFICIAIS";"Cabos e fibras sintéticas ou artificiais";"CABLES AND MAN-MADE FIBRES"
"3077";"ARTEFATOS PARA USO DOMESTICO, DE ALUMINIO";"Artefatos para uso doméstico, de alumínio";"HOUSEWARE ARTIFACTS, ALUMINUM"
"3080";"CAFE SOLUVEL";"Café solúvel";"INSTANT COFFEE"
"3081";"CAIXAS, SACOS E OUTRAS EMBALAGENS, DE PAPEL OU DE PASTA";"Caixas, sacos e outras embalagens, de papel ou de pasta";"BOXES, BAGS AND OTHER CONTAINERS, OF PAPER OR PULP"
"3083";"CAIXOTES, CAIXAS, ENGRADADOS, ETC. DE MADEIRA";"Caixotes, caixas, engradados, etc. de madeira";"BINS, BOXES, CRATES, ETC.DE WOOD"
"3089";"COQUE, BETUME E OUTROS RESIDUOS DE OLEO DE PETROLEO";"Coque, betume e outros resíduos de óleo de petróleo";"COKE, BITUMEN AND OTHER WASTE OF OIL"
"3090";"CAMARAS DE AR, DE BORRACHA";"Câmaras de ar, de borracha";"COLD AIR RUBBER"
"3096";"CALCADOS";"Calçados";"FOOTWEAR"
"3097";"CALDEIRAS, SUAS PARTES E APARELHOS AUXILIARES";"Caldeiras, suas partes e aparelhos auxiliares";"BOILERS, PARTS AND AUXILIARY EQUIPMENT"
"3098";"PREPARACOES E ARTIGOS FARMACEUTICOS P/ CIRURGIA, ETC.";"Preparações e artigos farmacêuticos p/ cirurgia, etc.";"PHARMACEUTICAL GOODS FOR SURGERY, ETC."
"3101";"COMPOSTOS DE FUNCAO CETONA OU DE FUNCAO QUINONA";"Compostos de função cetona ou de função quinona";"COMPOUND FUNCTION OF KETONETHE QUINONE FUNCTION"
"3103";"CHASSIS COM MOTOR E CARROCARIAS P/ VEICULOS AUTOMOVEIS";"Chassis com motor e carroçarias p/ veículos automóveis";"CHASSIS WITH ENGINES AND BODIES FOR MOTOR VEHICLES"
"3105";"PRODUTOS CERAMICOS REFRATARIOS";"Produtos cerâmicos refratários";"REFRACTORY CERAMIC PRODUCTS"
"3108";"CERVEJA DE MALTE";"Cerveja de malte";"BEER MADE FROM MALT"
"3111";"CIGARROS";"Cigarros";"CIGARETTES"
"3113";"COMPOSTOS INORGANICOS/ORGANICOS DE METAIS PRECIOSOS";"Compostos inorgânicos/orgânicos de metais preciosos";"INORGANIC AND ORGANIC COMPOUNDS OF PRECIOUS METALS"
"3116";"CHAPAS E FILMES FOTOGRAFICOS, NAO IMPRESSIONADOS";"Chapas e filmes fotográficos, não impressionados";"PHOTOGRAPHIC PLATES AND FILM, UNEXPOSED"
"3117";"CIRCUITOS IMPRESSOS";"Circuitos impressos";"PRINTED CIRCUITS"
"3121";"CHAPAS, FOLHAS, TIRAS, PELICULAS E LAMINAS, DE PLASTICO";"Chapas, folhas, tiras, películas e laminas, de plástico";"PLATES, SHEETS, STRIPS, FILM AND STRIP, OF PLASTICS"
"3122";"COMPOSTOS ORGANO-INORGANICOS";"Compostos organo-inorgânicos";"ORGANIC / INORGANIC COMPOUNDS"
"3123";"CONCENTRADO DE PROTEINA, SUBST. PROTEICA TEXTURIZADA";"Concentrado de proteína, subst. proteica texturizada";"PROTEIN CONCENTRATE, TEXTURED PROTEIN SUBSTANCES"
"3124";"CONDENSADORES ELETRICOS, FIXOS, VARIAVEIS OU AJUSTAVEIS";"Condensadores elétricos, fixos, variáveis ou ajustáveis";"ELECTRICAL CAPACITORS, FIXED, VARIABLE OR ADJUSTABLE"
"3126";"OXIDOS E HIDROXIDOS DE ALUMINIO";"Óxidos e hidróxidos de alumínio";"OXIDES AND HYDROXIDES ALUMINUM"
"3127";"OXIDOS E HIDROXIDOS DE FERRO";"Óxidos e hidróxidos de ferro";"OXIDES AND HYDROXIDES IRON"
"3128";"CADERNOS, AGENDAS E ARTIGOS SEMELHANTES";"Cadernos, agendas e artigos semelhantes";"NOTEBOOKS, DIARIES AND SIMILAR ARTICLES"
"3130";"MAQUINAS E APARELHOS P/TERRAPLANAGEM, PERFURACAO, ETC.";"Maquinas e aparelhos p/terraplanagem, perfuração, etc.";"MACHINERY AND EQUIPMENT EARTHMOVING, DRILLING, ETC."
"3131";"MAQUINAS E APARELHOS DE ELEVACAO DE CARGA,DESCARGA,ETC.";"Maquinas e aparelhos de elevação de carga,descarga,etc.";"MACHINES AND APPARATUS FOR LIFTING, DISCHARGE, ETC."
"3136";"MAQUINAS E APARELHOS P/FABR.DE PASTA CELULOSICA E PAPEL";"Maquinas e aparelhos p/fabr.de pasta celulósica e papel";"MACHINES AND APPARATUS FOR MANUFACTURE OF PULP AND PAPE"
"3139";"MAQUINAS E APARELHOS P/USO AGRICOLA (EXCETO TRATOR)";"Maquinas e aparelhos p/uso agrícola (exceto trator)";"MACHINES AND APPARATUS FOR AGRICULTURAL USE (EXCEPT TRA"
"3142";"MAQUINAS E APARELHOS P/ ENCHER, FECHAR, EMPACOTAR, ETC.";"Maquinas e aparelhos p/ encher, fechar, empacotar, etc.";"MACHINES AND APPARATUS FOR FILLING, CLOSING, PACKAGING,"
"3145";"MAQUINAS AUTOMATICAS P/PROCESS.DE DADOS E SUAS UNIDADES";"Maquinas automáticas p/process.de dados e suas unidades";"MACHINES AUTOMATIC DATA PROCESSING AND UNITS"
"3148";"MAQUINAS DE CALCULAR,DE CONTABILIDADE,REGISTRADORA,ETC.";"Maquinas de calcular,de contabilidade,registradora,etc.";"CALCULATING MACHINES, ACCOUNTING, RECORDS, ETC"
"3150";"MAQUINAS DE COSTURA,SUAS PARTES E PECAS";"Máquinas de costura,suas partes e pecas";"SEWING MACHINES, PARTS AND PARTS"
"3160";"MAQUINAS DE ESCREVER";"Maquinas de escrever";"TYPEWRITERS"
"3165";"MAQUINAS-FERRAMENTAS PARA FORJAR OU TRABALHAR METAIS";"Maquinas-ferramentas para forjar ou trabalhar metais";"MACHINES OR TOOLS FOR WORKING METAL FORGE"
"3166";"MAQS.QUE EXECUTEM 2 OU MAIS FUNCOES:IMPRESSAO/COPIA/FAX";"Maqs.que executem 2 ou mais funções:impressão/cópia/fax";"MACHINES RUNNING TWO OR MORE FUNCTIONS: PRINT / COPY / "
"3167";"ARTIGOS DE PLASTICO PARA TRANSPORTE OU PARA EMBALAGEM";"Artigos de plástico para transporte ou para embalagem";"ARTICLES OF PLASTIC PACKAGING FOR TRANSPORTATION OR FOR"
"3168";"MARGARINA, EXCETO A MARGARINA LIQUIDA";"Margarina, exceto a margarina liquida";"MARGARINE, EXCEPT LIQUID MARGARINE"
"3169";"OBRAS DE PLASTICO, OUTRAS";"Obras de plástico, outras";"ARTICLES OF PLASTIC, OTHER"
"3171";"PARTES E ACESSORIOS PARA MAQUINAS-FERRAMENTAS";"Partes e acessórios para maquinas-ferramentas";"PARTS AND ACCESSORIES FOR MACHINE TOOLS"
"3173";"ELETRODOS";"Eletrodos";"ELECTRODES"
"3175";"CHAPAS E FOLHAS DE BORRACHA VULCANIZADA NAO ENDURECIDA";"Chapas e folhas de borracha vulcanizada não endurecida";"SHEET AND VULCANIZED RUBBER"
"3177";"COLOFONIAS, ACIDOS RESINICOS E SEUS DERIVADOS";"Colofonias, ácidos resínicos e seus derivados";"ROSIN, RESIN ACIDS AND THEIR DERIVATIVES"
"3181";"COMPOSTOS DE FUNCOES NITROGENADAS";"Compostos de funções nitrogenadas";"NITROGEN-FUNCTION COMPOUNDS"
"3183";"JUNTAS E GAXETAS DE BORRACHA VULCANIZADA NAO ENDURECIDA";"Juntas e gaxetas de borracha vulcanizada não endurecida";"JOINTS AND GASKETS FOR VULCANIZED RUBBER"
"3187";"CENTRO DE USINAGEM E MAQS. ESTACOES MULTIPLAS, P/METAIS";"Centro de usinagem e maqs. estações múltiplas, p/metais";"MACHINING CENTER AND MACHINES MACHINES, FOR METALS"
"3188";"CORRENTES, DE FERRO FUNDIDO, FERRO OU ACO";"Correntes, de ferro fundido, ferro ou aço";"CHAIN OF IRON OR STEEL"
"3191";"MOTORES E TURBINAS PARA AVIACAO";"Motores e turbinas para aviação";"ENGINES AND TURBINES FOR AVIATION"
"3192";"MOTORES PARA PROPULSAO DE EMBARCACOES";"Motores para propulsão de embarcações";"ENGINES FOR MARINE PROPULSION"
"3193";"MOTORES PARA VEICULOS AUTOMOVEIS E SUAS PARTES";"Motores para veículos automóveis e suas partes";"ENGINES FOR MOTOR VEHICLES AND ITS PARTS"
"3194";"MOTORES DE PISTAO, OUTROS";"Motores à pistão, outros";"PISTON ENGINES, OTHER"
"3195";"MUNICOES DE CACA E ESPORTE";"Munições de caça e esporte";"HUNTING AMMUNITION AND SPORT"
"3196";"PARTES DE MOTORES E TURBINAS PARA AVIACAO";"Partes de motores e turbinas para aviação";"PIECES OF ENGINES AND TURBINES FOR AVIATION"
"3197";"OBRAS DE COURO NATURAL OU RECONSTITUIDO";"Obras de couro natural ou reconstituído";"WORKS LEATHER OR"
"3200";"PEDRAS PRECIOSAS OU SEMIPRECIOSAS, TRABALHADAS";"Pedras preciosas ou semipreciosas, trabalhadas";"OR SEMI-PRECIOUS STONES, WORKED"
"3201";"FALSOS TECIDOS SINTETICOS OU ARTIFICIAIS";"Falsos tecidos sintéticos ou artificiais";"NONWOVENS MAN-MADE"
"3203";"FARINHAS OU POS IMPROPRIAS P/ ALIM. HUMANA E TORRESMOS";"Farinhas ou pós improprias p/ alim. humana e torresmos";"AFTER MEAL OR UNFIT FOR HUMAN CONSUMPTION AND GREAVES"
"3205";"FENOIS, FENOIS-ALCOOIS";"Fenóis, fenóis-álcoois";"PHENOLS, PHENOL-ALCOHOLS"
"3207";"FITAS DE FIBRAS SINTETICAS OU ARTIFICIAIS";"Fitas de fibras sintéticas ou artificiais";"TAPES-MADE FIBERS"
"3211";"FORNOS INDUSTRIAIS OU DE LABORATORIO, NAO ELETRICOS";"Fornos industriais ou de laboratório, não elétricos";"INDUSTRIAL OR LABORATORY FURNACES, NON-ELETRIC"
"3213";"PRODUTOS DE CONFEITARIA SEM CACAU";"Produtos de confeitaria sem cacau";"CONFECTIONERY WITHOUT COCOA"
"3215";"PRODUTOS DA DESTILACAO DOS ALCATROES DE HULHA";"Produtos da destilação dos alcatroes de hulha";"PRODUCTS DISTILLATION OF COAL TAR"
"3217";"FUMO MANUFATURADO E SEUS SUCEDANEOS";"Fumo manufaturado e seus sucedâneos";"MANUFACTURED TOBACCO AND ITS SUBSTITUTES"
"3219";"GARRAFAS, FRASCOS E OUTROS RECIPIENTES DE VIDRO";"Garrafas, frascos e outros recipientes de vidro";"BOTTLES, BOTTLES AND OTHER GLASS CONTAINERS"
"3220";"PREPARACOES E CONSERVAS, DE CARNE BOVINA";"Preparações e conservas, de carne bovina";"PREPARATIONS AND CANNED, BEEF"
"3228";"PREPARACOES E CONSERVAS, DE CARNE DE FRANGO";"Preparações e conservas, de carne de frango";"PREPARATIONS AND PRESERVES, CHICKEN MEAT"
"3233";"GAS BUTANO, LIQUEFEITO";"Gás butano, liquefeito";"GAS BUTANE, LIQUEFIED"
"3235";"CIRCUITOS INTEGRADOS E MICROCONJUNTOS ELETRONICOS";"Circuitos integrados e microconjuntos eletrônicos";"INTEGRATED CIRCUITS AND MICROELETRONICS"
"3236";"CONSTRUCOES PRE-FABRICADAS";"Construções pré-fabricadas";"PREFABRICATED BUILDINGS"
"3240";"SISAL EM CORDEIS, CORDAS E CABOS";"Sisal em cordéis, cordas e cabos";"SISAL WIRY, ROPES AND CABLES"
"3251";"HELICOPTEROS";"Helicópteros";"HELICOPTERS"
"3252";"DEXTRINA E OUTROS AMIDOS E FECULAS MODIFICADOS";"Dextrina e outros amidos e féculas modificados";"DEXTRINS AND OTHER MODIFIED STARCHES"
"3253";"ELEMENTOS QUIMICOS E ISOTOPOS, RADIOATIVOS";"Elementos químicos e isótopos, radioativos";"CHEMICAL ELEMENTS AND ISOTOPES, RADIOACTIVE"
"3254";"DISTRIBUIDORES AUTOMATICOS DE PAPEL-MOEDA OU OUTS.OPER.";"Distribuidores automáticos de papel-moeda ou outs.oper.";"AUTOMATIC DISTRIBUTORS OF PAPER CURRENCY OR OTHER OPERA"
"3257";"ETERES ALCOOLICOS E SEUS DERIVADOS";"Éteres alcoólicos e seus derivados";"ETHER DERIVATIVES AND THEIR SPIRITS"
"3259";"FACAS, NAVALHAS, APARELHOS DE BARBEAR E TESOURAS";"Facas, navalhas, aparelhos de barbear e tesouras";"KNIVES, BLADES, SHAVING INSTRUMENTS AND SCISSORS"
"3260";"FERRAGENS PARA PORTAS E JANELAS, DE METAIS COMUNS";"Ferragens para portas e janelas, de metais comuns";"HARDWARE FOR DOORS AND WINDOWS, BASE METAL"
"3262";"FERRAMENTAS ELETROMECANICAS COM MOTOR, DE USO MANUAL";"Ferramentas eletromecânicas com motor, de uso manual";"ELECTROMECHANICAL TOOLS WITH MOTOR, MANUAL OF USE"
"3265";"FERRAMENTAS DE USO MANUAL OU PARA USO EM MAQUINAS";"Ferramentas de uso manual ou para uso em maquinas";"MANUAL TOOLS OR MACHINES FOR USE IN"
"3267";"FIBRAS DE VIDRO E SUAS OBRAS";"Fibras de vidro e suas obras";"FIBER GLASS AND GLASSWARE"
"3268";"FIOS, CABOS E CONDUTORES PARA USO ELETRICO";"Fios, cabos e condutores para uso elétrico";"WIRES, CABLES AND CONDUCTORS FOR ELECTRICAL"
"3271";"FIOS DE ALGODAO";"Fios de algodão";"COTTON YARN"
"3275";"FIOS DE FIBRAS TEXTEIS, SINTETICAS OU ARTIFICIAIS";"Fios de fibras têxteis, sintéticas ou artificiais";"FILAMENT YARN, SYNTHETIC OR ATIFICIAL"
"3277";"FIOS DE LA PENTEADA NAO ACONDICIONADOS P/VENDA A VAREJO";"Fios de lã penteada não acondicionados p/venda a varejo";"COMBED YARN NOT PUT UP AT P / RETAIL SALES"
